Reef Oasis Blue Bay 5*. Путевые заметки из Египта,Саша Сим,2018-04-19
"Project Blue Beam (NASA). Проект «Голубой луч» (Синий луч, Голубое сияние) НАСА",Дмитрий Литвин,2018-07-13
Синяя книга. The Blue Book. Книга первая. The Book One,Иннокентий Мамонтов,2018-02-28
"О любви, космосе и богах. Once in a blue moon",Кирилл Загустин,2018-01-30
Синяя книга. The Blue Book. Книга вторая. The Book Two,Иннокентий Мамонтов,2018-07-11
West Virginia Blue Book,,1972
The Blue Arabian Horse Catalog,Jane Llewellyn Ott,1961
Blue Lake Lore,Cynthia Brooks Holmberg,2002
Blue Hole Back Home,Joy Jordan-Lake,2010-01-01
Blue Cross Reports,,1969
